{
  "schema_version": 1,
  "identity": {
    "schema_version": 1,
    "recording_id": "10000000-0000-4000-8000-000000000001",
    "audio_variant_id": "10000000-0000-4000-8000-000000000002",
    "source_sha256": "1111111111111111111111111111111111111111111111111111111111111111",
    "source_duration_ms": 10000,
    "source_timebase": "SOURCE_MILLISECONDS_V1",
    "embedding_model_id": "10000000-0000-4000-8000-000000000003",
    "embedding_manifest_sha256": "2222222222222222222222222222222222222222222222222222222222222222",
    "semantic_interpreter_id": "10000000-0000-4000-8000-000000000004",
    "interpreter_manifest_sha256": "3333333333333333333333333333333333333333333333333333333333333333",
    "preprocessing_sha256": "4444444444444444444444444444444444444444444444444444444444444444"
  },
  "track_character": {
    "axes": {
      "energy": {
        "value": 0.2,
        "confidence": 0.75,
        "abstained": false,
        "reason_code": null
      },
      "valence": {
        "value": null,
        "confidence": null,
        "abstained": true,
        "reason_code": "UNCALIBRATED"
      },
      "future_axis": {
        "value": -0.1,
        "confidence": 0.625,
        "abstained": false,
        "reason_code": null
      }
    }
  },
  "keyframes": [
    {
      "time_ms": 0,
      "state": {
        "axes": {
          "energy": {
            "value": -0.5,
            "confidence": 0.5,
            "abstained": false,
            "reason_code": null
          },
          "future_axis": {
            "value": 0.1,
            "confidence": 0.75,
            "abstained": false,
            "reason_code": null
          },
          "valence": {
            "value": null,
            "confidence": null,
            "abstained": true,
            "reason_code": "UNCALIBRATED"
          }
        }
      }
    },
    {
      "time_ms": 10000,
      "state": {
        "axes": {
          "energy": {
            "value": 0.5,
            "confidence": 0.75,
            "abstained": false,
            "reason_code": null
          },
          "future_axis": {
            "value": null,
            "confidence": null,
            "abstained": true,
            "reason_code": "UNCALIBRATED"
          },
          "valence": {
            "value": null,
            "confidence": null,
            "abstained": true,
            "reason_code": "UNCALIBRATED"
          }
        }
      }
    }
  ],
  "events": [
    {
      "time_ms": 5000,
      "event_type": "future_event",
      "strength": 0.25,
      "confidence": 0.5
    }
  ]
}
