{"events":[{"confidence":0.5,"event_type":"future_event","strength":0.25,"time_ms":5000}],"identity":{"audio_variant_id":"10000000-0000-4000-8000-000000000002","embedding_manifest_sha256":"2222222222222222222222222222222222222222222222222222222222222222","embedding_model_id":"10000000-0000-4000-8000-000000000003","interpreter_manifest_sha256":"3333333333333333333333333333333333333333333333333333333333333333","preprocessing_sha256":"4444444444444444444444444444444444444444444444444444444444444444","recording_id":"10000000-0000-4000-8000-000000000001","schema_version":1,"semantic_interpreter_id":"10000000-0000-4000-8000-000000000004","source_duration_ms":10000,"source_sha256":"1111111111111111111111111111111111111111111111111111111111111111","source_timebase":"SOURCE_MILLISECONDS_V1"},"keyframes":[{"state":{"axes":{"energy":{"abstained":false,"confidence":0.5,"reason_code":null,"value":-0.5},"future_axis":{"abstained":false,"confidence":0.75,"reason_code":null,"value":0.1},"valence":{"abstained":true,"confidence":null,"reason_code":"UNCALIBRATED","value":null}}},"time_ms":0},{"state":{"axes":{"energy":{"abstained":false,"confidence":0.75,"reason_code":null,"value":0.5},"future_axis":{"abstained":true,"confidence":null,"reason_code":"UNCALIBRATED","value":null},"valence":{"abstained":true,"confidence":null,"reason_code":"UNCALIBRATED","value":null}}},"time_ms":10000}],"schema_version":1,"track_character":{"axes":{"energy":{"abstained":false,"confidence":0.75,"reason_code":null,"value":0.2},"future_axis":{"abstained":false,"confidence":0.625,"reason_code":null,"value":-0.1},"valence":{"abstained":true,"confidence":null,"reason_code":"UNCALIBRATED","value":null}}}}